UPRN,Districts,Polling_Station_Name,Polling_Station_Address,Easting,Northing
10091010566,AW2,"Capel Dinmael Chapel CM","Capel Dinmael Chapel CM, Dinmael, Llangwm, Corwen, LL21 0NY",300574.98,344734.45
10091010566,AX1,"Capel Dinmael Chapel CM","Capel Dinmael Chapel CM, Dinmael, Llangwm, Corwen, LL21 0NY",300574.98,344734.45
10024342499,AU1,"Canolfan Addysg Bro Aled Education Centre","Canolfan Addysg Bro Aled Education Centre, Llansannan, LL16 5HN",293152,365764
10091010576,AS1,"Canolfan Gymunedol Bro Cernyw","Canolfan Gymunedol Bro Cernyw, Ysgol Bro Cernyw, Llangernyw, Abergele, LL22 8PP",287532,367272
10024340793,AV1,"Canolfan Addysg Uwchaled Education Centre","Canolfan Addysg Uwchaled Education Centre, Cerrigydrudion, Corwen, LL21 9SW",295459,348870
10091009979,AK2,"Canolfan Dewi Sant / Saint David's Centre","Canolfan Dewi Sant / Saint David's Centre, South Parade, Pensarn, Abergele, LL22 7RG",294809,378591
50000007375,AD3,"Canolfan Cymunedol Bryn Cadno Community Centre","Canolfan Cymunedol Bryn Cadno Community Centre, Bryn Cadno, Bae Colwyn Uchaf / Upper Colwyn Bay, Bae Colwyn / Colwyn Bay, LL29 6DW",284518,377829
10091010577,AS3,"Canolfan Cymuned / Community Centre","Canolfan Cymuned / Community Centre, Capel Pandy Tudur, Pandy Tudur, Llangernyw, LL22 8UL",285902,364344
10024340835,AS2,"Canolfan Gymdeithasol Gwytherin Community Centre","Canolfan Gymdeithasol Gwytherin Community Centre, Gwytherin, Llangernyw, Abergele, LL22 8UU",287744,361493
10024341034,AI2,"Canolfan Gymuned Rhyd y Foel Community Centre","Canolfan Gymuned Rhyd y Foel Community Centre, Rhyd Y Foel, Betws Yn Rhos, Abergele, LL22 8DY",291244,376882
200002946532,AM1,"Canolfan Gymuned Bae Kinmel Bay Community Centre","Canolfan Gymuned Bae Kinmel Bay Community Centre, Foryd Road, Bae Kinmel / Kinmel Bay, Rhyl, LL18 5BT",298947,380397
10024342765,AH2,"Llysfaen Village Hall","Llysfaen Village Hall, Dolwen Road, Llysfaen, Bae Colwyn / Colwyn Bay, LL29 8SS",289378,377469
50000007859,GA,"Canolfan Porthlwyd","Canolfan Porthlwyd, Conway Road, Dolgarrog, Conwy, LL32 8JU",276932,367380
10024206861,CA,"Canolfan Cymunedol Shiloh Community Centre","Canolfan Cymunedol Shiloh Community Centre, Cwm Penmachno, Betws Y Coed, LL24 0RH",275958,347693
200002948909,"LF, LG, LH","Canolfan Trindod / Trinity Centre","Canolfan Trindod / Trinity Centre, Trinity Avenue, Llandudno, LL30 2TQ",277922,381773
200001762051,AJ1,"Capel Mynydd Seion / Mynydd Seion Chapel","Capel Mynydd Seion / Mynydd Seion Chapel, Chapel Street, Abergele, LL22 7AW",294531,377396
10091010567,FC,"Capel Peniel Chapel","Capel Peniel Chapel, Peniel Street, Deganwy, Conwy, LL31 9UP",278457.59,378816.36
50000008916,PA,"St Ffraid's Church House","St Ffraid's Church House, Church Street, Glan Conwy, Bae Colwyn / Colwyn Bay, LL28 5NA",280393,376057
50000008916,PB,"St Ffraid's Church House","St Ffraid's Church House, Church Street, Glan Conwy, Bae Colwyn / Colwyn Bay, LL28 5NA",280393,376057
10024341047,AL1,"North Coast Church","North Coast Church, Gors Road, Towyn, Abergele, LL22 9NR",297885,379001
50000004480,AA2,"Colwyn Bay Cricket Club","Colwyn Bay Cricket Club, 77 Penrhyn Avenue, Llandrillo yn Rhos / Rhos On Sea, Bae Colwyn / Colwyn Bay, LL28 4LR",283831,380769
10024341057,EA,"Canolfan Cymunedol Capel Curig Community Centre","Canolfan Cymunedol Capel Curig Community Centre, Capel Curig, Betws Y Coed, LL24 0EE",273200,357511
10024340563,LJ,"Canolfan Cymunedol Bae Penrhyn Bay Community Centre","Canolfan Cymunedol Bae Penrhyn Bay Community Centre, Community Centre, Derwen Lane, Bae Penrhyn / Penrhyn Bay, Llandudno, LL30 3LA",281638,380814
10024342961,AX2,"The Institute","The Institute, Llangwm, Corwen, LL21 0RA",296675,344697
10024340542,"LA, LB","Canolfan Cymunedol Craig Y Don Community Centre","Canolfan Cymunedol Craig Y Don Community Centre, Queen's Road, Craig Y Don, Llandudno, LL30 1TE",279387,381617
10091010568,LL,"Eglwys Bresbyteraidd / Presbyterian Church","Eglwys Bresbyteraidd / Presbyterian Church, Maes Gwyn Road, Bae Penrhyn / Penrhyn Bay, Llandudno, LL30 3PP",282466.54,381484.67
200001866568,"LC, LE","Capel Seilo Chapel","Capel Seilo Chapel, Arvon Avenue, Llandudno, LL30 2DY",277946,382458
50000001676,FA,"St Johns Church Hall","St Johns Church Hall, Rose Hill Street, Conwy, LL32 8LD",278222,377498
50000001676,FB,"St Johns Church Hall","St Johns Church Hall, Rose Hill Street, Conwy, LL32 8LD",278222,377498
100100952785,AD1,"St Johns Methodist Church","St Johns Methodist Church, Conway Road, Bae Colwyn / Colwyn Bay, LL29 7DA",284618,379135
100100952785,AD2,"St Johns Methodist Church","St Johns Methodist Church, Conway Road, Bae Colwyn / Colwyn Bay, LL29 7DA",284618,379135
10091006963,LO,"Neuadd Eglwys / Church Hall","Neuadd Eglwys / Church Hall, Eglwys St Paul / St Pauls Church, Mostyn Broadway, Llandudno, LL30 1YT",279260,381992
10024342177,AF2,"The Church in the Park","The Church in the Park, Berthes Road, Hen Golwen / Old Colwyn, Bae Colwyn / Colwyn Bay, LL29 9SD",286732,378395
200002948547,AG1,"Old Colwyn Methodist Church","Old Colwyn Methodist Church, Wynn Avenue, Hen Golwen / Old Colwyn, Bae Colwyn / Colwyn Bay, LL29 9RF",287075,378255
10091006937,BB,"Capel Bethel","Capel Bethel, Melin Y Coed to Carmel, Melin Y Coed, Llanrwst, LL26 0SG",281488,360504
10091010570,AW1,"Festri Capel / Chapel Vestry","Festri Capel / Chapel Vestry, Llanfihangel Glyn Myfyr, Corwen, LL21 9UH",299133.58,349134.88
10091010569,AF1,"Community Room","Community Room, Kennedy Court, Hen Golwen / Old Colwyn, Bae Colwyn / Colwyn Bay, LL29 9TS",286492.55,378221.71
200002946508,AM2,"Kinmel Bay Evangelical Church","Kinmel Bay Evangelical Church, St Asaph Avenue, Bae Kinmel / Kinmel Bay, Rhyl, LL18 5EY",299029,379506
100101036616,AI1,"Llanddulas Youth and Community Centre","Llanddulas Youth and Community Centre, Beach Road, Llanddulas, Abergele, LL22 8HB",290873,378302
10024342200,FE,"Llandudno Junction Community Sports and Social Club","Llandudno Junction Community Sports and Social Club, Victoria Drive, Cyffordd Llandudno / Llandudno Junction, LL31 9PG",279312,378696
10024342200,FF,"Llandudno Junction Community Sports and Social Club","Llandudno Junction Community Sports and Social Club, Victoria Drive, Cyffordd Llandudno / Llandudno Junction, LL31 9PG",279312,378696
10024340711,FG,"War Memorial Institute","War Memorial Institute, Penrhos Avenue, Cyffordd Llandudno / Llandudno Junction, LL31 9EW",279829,377907
10024342440,MA,"Canolfan Cymunedol / Community Centre","Canolfan Cymunedol / Community Centre, Town Hall, Village Road, Llanfairfechan, LL33 0AB",268297,374672
10024342440,MB,"Canolfan Cymunedol / Community Centre","Canolfan Cymunedol / Community Centre, Town Hall, Village Road, Llanfairfechan, LL33 0AB",268297,374672
10024342440,MC,"Canolfan Cymunedol / Community Centre","Canolfan Cymunedol / Community Centre, Town Hall, Village Road, Llanfairfechan, LL33 0AB",268297,374672
10091006960,FD,"Hen Ysgol Llanrhos / Llanrhos Old School","Hen Ysgol Llanrhos / Llanrhos Old School, Conway Road, Llanrhos, Llandudno, LL30 1PY",279288,380219
10023740030,OA,"Canolfan Ieuenctid Llanrwst Youth Centre","Canolfan Ieuenctid Llanrwst Youth Centre, Watling Street, Llanrwst, LL26 0LS",280021,361602
10023740030,OB,"Canolfan Ieuenctid Llanrwst Youth Centre","Canolfan Ieuenctid Llanrwst Youth Centre, Watling Street, Llanrwst, LL26 0LS",280021,361602
10024339845,QB,"Llyfrgell Penmaenmawr Library","Llyfrgell Penmaenmawr Library, Bangor Road, Penmaenmawr, LL34 6DA",271871,376267
10024339561,QC,"Maen Alaw","Maen Alaw, Bangor Road, Penmaenmawr, LL34 6LE",271527,376255
10024343088,CB,"Neuadd Goffa Penmachno Memorial Hall","Neuadd Goffa Penmachno Memorial Hall, Newgate Street, Penmachno, Betws Y Coed, LL24 0UR",279043,350650
50000005072,AE3,"Neuadd Yr Eglwys Nant Y Glyn Church Hall","Neuadd Yr Eglwys Nant Y Glyn Church Hall, Nant Y Glyn Methodist Church, Nant Y Glyn Road, Bae Colwyn / Colwyn Bay, LL29 7ST",285373,378429
10091010571,AB1,"Mobile Meeting Room, Government Buildings","Mobile Meeting Room, Government Buildings, Dinerth Road, Llandrillo yn Rhos / Rhos On Sea, Bae Colwyn / Colwyn Bay, LL28 4UH",283173.12,380447.07
10024339891,IA,"Neuadd Aberconwy Hall","Neuadd Aberconwy Hall, Eglwysbach, Bae Colwyn / Colwyn Bay, LL28 5UD",280366,370463
10024342715,RA,"Neuadd Y Bentref Trefriw Village Hall","Neuadd Y Bentref Trefriw Village Hall, Trefriw, LL27 0JH",278105,363155
10024342715,RB,"Neuadd Y Bentref Trefriw Village Hall","Neuadd Y Bentref Trefriw Village Hall, Trefriw, LL27 0JH",278105,363155
10091007039,BA,"Neuadd Garth Garmon","Neuadd Garth Garmon, Capel Garmon, Llanrwst, LL26 0RW",281530,355491
10035305216,DA,"Neuadd Goffa / Memorial Hall","Neuadd Goffa / Memorial Hall, Llanrwst Road, Tal y Bont, Conwy, LL32 8QF",276641,368984
10035305216,DB,"Neuadd Goffa / Memorial Hall","Neuadd Goffa / Memorial Hall, Llanrwst Road, Tal y Bont, Conwy, LL32 8QF",276641,368984
10024339867,AO1,"Neuadd Goffa / Memorial Hall","Neuadd Goffa / Memorial Hall, Denbigh Road, Llanfairtalhaiarn, Abergele, LL22 8SE",292827,370128
10024340749,AU2,"Neuadd Goffa Plwyf y Bylchau Memorial Hall","Neuadd Goffa Plwyf y Bylchau Memorial Hall, Groes, Llansannan, Denbigh, LL16 5RT",300732,364764
10023741525,DC,"Neuadd Goffa Rowen Memorial Hall","Neuadd Goffa Rowen Memorial Hall, Llanerch, Rowen, Conwy, LL32 8YU",275955,372060
10024342180,SA,"Neuadd Goffa / Memorial Hall","Neuadd Goffa / Memorial Hall, Ysbyty Ifan, Betws Y Coed, LL24 0NS",284306,348863
10024342180,SB,"Neuadd Goffa / Memorial Hall","Neuadd Goffa / Memorial Hall, Ysbyty Ifan, Betws Y Coed, LL24 0NS",284306,348863
10024343579,AN2,"Neuadd Gymuned Llanelian Community Hall","Neuadd Gymuned Llanelian Community Hall, Llanelian Road, Llanelian Yn Rhos, Bae Colwyn / Colwyn Bay, LL29 8YA",286378,376506
10091010575,JA,"Neuadd Gymuned Henryd Community Hall","Neuadd Gymuned Henryd Community Hall, Henryd Road, Henryd, Conwy, LL32 8YB",277001.73,374805.45
10091010575,JB,"Neuadd Gymuned Henryd Community Hall","Neuadd Gymuned Henryd Community Hall, Henryd Road, Henryd, Conwy, LL32 8YB",277001.73,374805.45
10024340477,LK,"Neuadd Y Pentref / Village Hall","Neuadd Y Pentref / Village Hall, Bryn Pydew Road, Bryn Pydew, Cyffordd Llandudno / Llandudno Junction, LL31 9QA",281189,379383
10023740068,AJ2,"Neuadd Y Pentref / Village Hall","Neuadd Y Pentref / Village Hall, Church Street, Llansan Sior / St George, Abergele, LL22 9BP",297459,375730
10024340736,AP1,"Neuadd Y Pentref / Village Hall","Neuadd Y Pentref / Village Hall, Llannefydd, LL16 5EA",298143,370626
10024340451,AN1,"Neuadd Y Pentref / Village Hall","Neuadd Y Pentref / Village Hall, Dolwen Road, Betws Yn Rhos, LL22 8AP",290577,373629
100101036865,AG3,"Ysgol Babanod Penmaenrhos Infant School","Ysgol Babanod Penmaenrhos Infant School, Craig Road, Hen Golwyn / Old Colwyn, LL29 9HN",287812,378243
10024340733,LI,"Neuadd Y Pentref / Village Hall","Neuadd Y Pentref / Village Hall, Pendre Road, Ochr y Penrhyn / Penrhynside, Llandudno, LL30 3DD",281408,381633
10035305633,AH1,"Canolfan Gymuned Peulwys Community Centre","Canolfan Gymuned Peulwys Community Centre, Ysgol Tan Y Marian, Swn Y Don, Hen Golwyn / Old Colwyn, Bae Colwyn / Colwyn Bay, LL29 9LL",288107,377967
10091007373,AE2,"Religious Society of Friends Meeting House","Religious Society of Friends Meeting House, Erskine Road, Bae Colwyn / Colwyn Bay, LL29 8EU",285407,378737
10091010574,QA,"St Gwynans Parish Hall","St Gwynans Parish Hall, Glan Yr Afon Road, Dwygyfylchi, Penmaenmawr, LL34 6RN",273568.86,377330.6
10024342719,AA1,"Scout Headquarters","Scout Headquarters, Church Road, Llandrillo yn Rhos / Rhos On Sea, Bae Colwyn / Colwyn Bay, LL28 4DJ",283560,380889
50000009101,AG2,"Canolfan Gymuned Tan Y Lan Community Centre","Canolfan Gymuned Tan Y Lan Community Centre, Tan Y Lan Road, Hen Golwyn / Old Colwyn, Bae Colwyn / Colwyn Bay, LL29 9BB",287772,378633
200001866318,LM,"Canolfan Adnoddau Cymunedol Ty Hapus Community Resource Centre","Canolfan Adnoddau Cymunedol Ty Hapus Community Resource Centre, Ffordd Penrhyn, Llandudno, LL30 1HB",278507,381628
200001866318,LN,"Canolfan Adnoddau Cymunedol Ty Hapus Community Resource Centre","Canolfan Adnoddau Cymunedol Ty Hapus Community Resource Centre, Ffordd Penrhyn, Llandudno, LL30 1HB",278507,381628
10035043947,AC1,"Neuadd Y Pentref Mochdre Village Hall","Neuadd Y Pentref Mochdre Village Hall, Old Conway Road, Mochdre, Bae Colwyn / Colwyn Bay, LL28 5HU",282541,378440
10024342954,DD,"Rowen Young Farmers Club Hall","Rowen Young Farmers Club Hall, Tyn Y Groes, Conwy, LL32 8TJ",277372,371686
10091007487,HA,"Canolfan Gymunedol Dolwyddelan Community Centre","Canolfan Gymunedol Dolwyddelan Community Centre, Dolwyddelan, LL25 0SZ",273786,352274
10024341082,KA,"Ysgol Llanddoged","Ysgol Llanddoged, Llanddoged, Llanrwst, LL26 0BJ",280710,363732
10024341082,KB,"Ysgol Llanddoged","Ysgol Llanddoged, Llanddoged, Llanrwst, LL26 0BJ",280710,363732
10024341066,AT1,"Ysgol Pentrefoelas","Ysgol Pentrefoelas, Pentrefoelas, Betws Y Coed, LL24 0LE",287386,351317
10024340643,LD,"Canolfan Addysg Yr Wyddfid Education Centre","Canolfan Addysg Yr Wyddfid Education Centre, Llwynon Road, Great Orme, Llandudno, LL30 2QF",277456,382810
50000021676,AE1,"Neuadd Y Dref / Town Hall","Neuadd Y Dref / Town Hall, Rhiw Road, Bae Colwyn / Colwyn Bay, LL29 7TF",285048,378779
10091010581,AB2,"Neuadd Yr Eglwys Fethodistaidd / Methodist Church Hall","Neuadd Yr Eglwys Fethodistaidd / Methodist Church Hall, St George's Road, Llandrillo yn Rhos / Rhos On Sea, Bae Colwyn / Colwyn Bay, LL28 4HF",283908,380427
10091010581,AA3,"Neuadd Yr Eglwys Fethodistaidd / Methodist Church Hall","Neuadd Yr Eglwys Fethodistaidd / Methodist Church Hall, St George's Road, Llandrillo yn Rhos / Rhos On Sea, Bae Colwyn / Colwyn Bay, LL28 4HF",283908,380427
10035305011,AK1,"Scout Hall","Scout Hall, Groes Lwyd, Abergele, LL22 7SZ",294467,377877
10024340906,AA,"Neuadd Goffa / Memorial Hall","Neuadd Goffa / Memorial Hall, Betws Y Coed, LL24 0BB",279208,356736
